{"schema":"io.navocms.astro-artifact.v1","format":"navocms-astro-source-bundle/v1","tenantId":"tenant","siteId":"site","digests":{"content":"sha256:aaaaaaaaaaaaaaaaaaaaaaaaaaaaaaaaaaaaaaaaaaaaaaaaaaaaaaaaaaaaaaaa","design":"sha256:bbbbbbbbbbbbbbbbbbbbbbbbbbbbbbbbbbbbbbbbbbbbbbbbbbbbbbbbbbbbbbbb","delivery":"sha256:cccccccccccccccccccccccccccccccccccccccccccccccccccccccccccccccc","governance":"sha256:dddddddddddddddddddddddddddddddddddddddddddddddddddddddddddddddd","registrations":"sha256:eeeeeeeeeeeeeeeeeeeeeeeeeeeeeeeeeeeeeeeeeeeeeeeeeeeeeeeeeeeeeeee","media":"sha256:ffffffffffffffffffffffffffffffffffffffffffffffffffffffffffffffff"},"files":[{"path":"src/pages/en/index.astro","sha256":"aaaaaaaaaaaaaaaaaaaaaaaaaaaaaaaaaaaaaaaaaaaaaaaaaaaaaaaaaaaaaaaa"}]}
